date,ip 属地,评分,comments
2019-04-22,未知,5,值得一看，来柳州旅游必打卡地，沿途还有你们喜欢的紫荆花
2017-09-08,未知,5,我小时候一直玩乐的公园，30几年了变化真大，但是有一点不变就是游玩的人一直都是非常多的。
2017-11-26,未知,5,很好，特别是山顶值得一看，主要能看到柳州的夜景
2017-09-30,未知,4,还不错吧，风景区，因为广西的山跟外边的山不一样，广西很多山都是80度90度垂直往上的，所以看起来很好看，所以风景还是挺不错的
2017-08-26,未知,5,为柳州古八景之一，山上绿树成荫，山脚一泓碧水称小龙潭。公园打造的很漂亮景色十分秀丽。
2015-10-19,未知,5,鱼峰山，传说是刘三姐飞天的地方，小时候不知道爬上去了多少次。山下有不少壮族人在对山歌
2017-08-28,未知,5,爬山累但是山顶景色好，还有刘三姐，还有表演
2023-03-20,广西,4,城南的鱼峰山，也叫立鱼峰，和让背马鞍山有缆车🚡连接。登顶可以看城景，就是台阶陡，下山慢点，注意膝盖。
2022-12-06,广西,5,坐落在柳州市区内的一个公园，交通十分的便利。市民平日休闲好地方
2021-03-19,未知,5,绿树成荫，鸟语花香，三三两两的人群，来去匆匆，很有生活气息！
2017-02-25,未知,5,这是一个比较小的休闲公园，不过传说中的刘三姐在这里骑鱼升天哟
2017-02-07,未知,4,很休闲的一个公园，没有什么好玩的，登山锻炼身体还是可以的。
2017-06-26,未知,4,这是一个以劉三姐為主題的城市综合公园，主景是小龙潭和鱼峰山，站在鱼峰之.顛，可观覽柳州市全景。
2016-11-05,未知,5,传说刘三姐住过的地方，也是柳州前辈们喜欢唱山歌的地方
2021-02-24,未知,5,公园里有一座鱼峰山，不算太高，登上山顶，风景独好！
2017-02-05,未知,5,传说刘三姐骑鱼升天的地方，好多老人喜欢在这唱山歌呢
2016-02-11,未知,4,这里也是柳州纪念刘三姐的文化公园，流传着动人的故事，风景也挺美，山上可眺望市区与柳江风光。
2015-12-03,未知,4,所谓立鱼峰很形象的，山峰就像一条鱼直立，很奇妙！
2018-02-11,未知,5,公园很大，环境很安静，柔和，到这里可以放开身心
2017-11-28,未知,5,风景区嘅风景比较优美，好安静，适合游人去换啥
2017-03-07,未知,3,爬鱼峰山和浏览小龙潭 山不算高 可以看柳州的全景 现在里面全是老人的世界 差不多变成老人公园
2017-03-26,未知,5,比较休闲的一个小公园，人们喜欢来这里唱山歌
2018-02-11,未知,5,景区很漂亮，环境很好，树木茂盛，湖水干净
2017-07-22,未知,5,在这个处于闹市区的风景区内，感受到热闹
2016-04-13,未知,4,风景秀丽，景色宜人，适合饭后散步，散心
2017-10-28,未知,5,柳州市内免费嘅公园，风景还是不错的
2017-07-22,未知,5,这里的游乐设施还真不少呀，小孩喜欢
2017-01-10,未知,5,传说歌仙刘三姐在这里骑鱼升天的地方
2020-05-16,未知,5,如蜡笔画一般的美景，照相太美了！
2017-09-29,未知,5,地处闹市 没有围墙 无需门票 环境优美
2017-03-17,未知,5,风景秀丽 景色宜人 城市的一道风景。
2017-04-09,未知,5,这里的紫金花也开了哟，好美好美
2016-12-03,未知,5,传说歌仙刘三姐来过的地方，看看
2016-09-24,未知,5,登高望远的好地方。还有观光缆车
2016-01-30,未知,4,值得去，空气好，男女老少和谐共处各种运动游戏热闹非凡
2017-08-06,未知,4,市中心休闲好去处，爬上马鞍山可以一览市中心风光！
2016-01-15,未知,3,公园小了点，其他还好，不错不错，值得去看看玩玩
2015-11-13,未知,4,一般般 就是性价比比上海高 菜量多便宜 实在
2021-02-07,未知,4,刘三姐升仙的地方，优美绝伦，仙女传说
2020-04-03,未知,3,非常的清秀，而且空气非常的清晰，去的时候人不是很多，而且这个，景区还是很好的
2023-05-19,广西,4,到山顶了可以看到夜景，很漂亮的。
2016-03-11,未知,3,人特别多，喜欢热闹的人比较适合。没有很多小朋友玩的东西。
2019-11-22,未知,1,鱼峰不是很大也不是很高，眺望时间很一般（相比马鞍山公园），如果时间充裕可以去看看。本来是特意赶过来爬，然后坐缆车上去，结果缆车没有开放，还是挺失望的。（后面两张拍摄于马鞍山）
2018-10-11,未知,3,风景不错，缆车上的感觉很好，山上环境很差，道路很小，人多，可以欣赏风景的地方很小。缆车服务很差。
