date,ip 属地,评分,comments
2023-02-10,上海,5,了解了柳宗元的故事，还有柳州的古人类，值得推荐
2020-03-01,未知,5,服务特别好，而且位置很好，交通方便，值得一看
2017-07-25,未知,5,了解历史，了解科普知识，带孩子看看还是不错的
2023-02-07,福建,5,趣味性很强，值得带孩子多次去，环境也很好！
2018-01-15,未知,5,值得非常好 我的家乡。。
2017-10-20,未知,5,这里记录了柳州市的文化历史，还是值得一看的
2023-02-07,广西,5,柳州是工业城市，所以这个工业博物馆很不错
2021-04-26,未知,5,免费的 不用门票 走过路过的朋友们可以去看看
2018-02-01,未知,5,历史虽然不是特别的长，但是民俗很有特点。
2017-07-11,未知,5,这里记载了柳州的文化历史，还是值得一看的
2021-10-28,未知,5,开了很多年了，柳州的标志。。。。。。。
2017-05-21,未知,5,位于柳州的市中心，交通便利，挺好找的。
2020-01-14,未知,5,柳州博物馆展民族风俗，壮侗水苗等。
2018-10-12,未知,5,免费！周末带小孩逛逛一定会有收获！
2017-03-23,未知,5,融合了柳州的历史文化，真的值得看看
2021-06-26,未知,5,东西很多，历史悠久，老柳州都知道
2016-09-29,未知,5,很好，值得大家去了解一下柳州历史
2023-05-13,江苏,5,值得一去，环境不错，必须必须。
2023-04-23,北京,5,这里还挺不错的，挺值得来这里的
2022-09-26,山东,5,【景色】非常有特色，值得一看。
2017-04-26,未知,5,集中了柳州特色，非常值得一看。
2016-11-02,未知,5,可以进去看看，里面好多柳州文化
2023-06-19,广东,4,柳州博物馆是让我这次旅途值得刺激难忘的时光啊还有我也感到美好的回忆呀
2023-03-10,广东,4,柳州博物馆是让我这次旅途值得刺激难忘的青春啊还有我也感到美好的回忆呀
2023-04-21,广东,4,柳州博物馆是让我这次旅途值刺激难忘的青春啊还有我也感到美好的回忆呀
2020-10-04,未知,4,柳侯公园对面，扫码进入，不如工业博物馆印象深。
2017-09-01,未知,4,感觉空闲时间没什么地方去，就还是去博物馆转转了
2023-04-15,广西,4,来柳州打卡柳州博物馆
2023-08-10,广西,3,喜欢那个小小讲解员
2023-07-31,广东,5,不限时这一点真的爱了，可以慢慢悠悠的享受整个过程，被治愈了
2023-03-19,广西,5,很棒的一个博物馆！
2024-06-20,广西,5,晚上去看风景更好，可玩性有待提高，建议加上望远镜
2022-10-23,江苏,3,说起柳州，不得不提起螺蛳粉，走在柳州街头，真是满大街都是酸笋的味道啊，味道真是一言难尽
2017-02-16,未知,4,不算很大，但是还是很多干货，柳州还是有历史的
2016-02-03,未知,4,里面的街道模仿很有特色，感觉置身在那年代感觉
2017-06-16,未知,4,景色秀丽……趣味十足性价比超高的一个好地方
2023-04-15,加拿大,4,这里的风景真的非常不错，值得推荐给大家。
2016-10-10,未知,4,对此广西的其他博物馆！还可以！设施也完善
2022-11-10,江苏,3,虽然位置有点难找，但胜在人少，没有嘈杂的环境，整个氛围非常nice，不错子😁
2023-02-23,广西,4,广西省柳州市的市立博物馆，值得一看。
2021-05-26,未知,3,位于柳州市柳北区解放北路37号，是一座建筑规模不小的房屋，外观设计也是不错的
2024-09-30,广西,5,自驾车转了两圈才进到大院，来到的时候已准备闭馆，赶上了末班车，总体体验可以
2023-10-03,广西,5,有大又漂亮 离高铁站很近 窗户外面很美
2022-10-20,广东,4,了解柳州历史，必去柳州博物馆一游！
2023-10-15,海南,5,很适合带小朋友来游玩，既学到知识，又很有趣的一个地方，关键还免费，点个赞
2023-05-23,上海,4,当地比较大型的博物馆，藏品众多～
2021-12-11,未知,4,很不错，对孩子学习历史很有帮助。
2021-02-07,未知,4,柳州工业发展史，历史沿革的感觉，
2023-06-28,广东,4,挺有特色的地方，很不错的选择。
2022-12-02,广东,4,环境还不错，有时间可以去看看。
2022-11-14,广东,4,可以去看看，挺不错的地方。。。
2017-11-11,未知,4,到龙城柳州，这个地方非去不可。
2017-09-01,未知,4,每个地方的博物馆都是值得一看的
2021-04-08,未知,3,博物馆面积不小，展品数量众多，很多都是非常珍贵的物品，值得去参观
2023-08-17,广东,5,太值了。园区景色不错，动物种类多，还有大熊猫看，门票便宜。
2023-08-06,广西,5,孩子很喜欢恐龙化石
2020-09-18,未知,3,市中心有个这样的博物馆很不错，可以经常去看看展出，又方便。
2023-08-03,广西,5,预约好了，出酒店的时候又忘了带身份证，所以没去成，很遗憾
2023-09-11,浙江,5,值得去一次
2023-05-01,广西,5,还不错的咧
2019-11-02,未知,5,在广场边上，经常有各种免费的展览，可以带小朋友去。
2023-05-03,广西,5,玩的很舒服！筏工很实在，没有缺路程，很认真负责！
2019-10-07,未知,5,周末假日经常去的吖～小朋友很爱啊，会定期换布景啊
2023-08-11,广西,5,博物馆虽然不大，但也很不错，让小朋友了解历史
2023-09-28,辽宁,5,免费的博物馆，三层展厅，可以观看影片，好评
2019-10-02,未知,5,很好，里面有空调，非常舒服，感觉很逼真。
2023-08-06,广西,5,今天去玩了。。。直接进去的 不需要扫码
2023-08-05,广西,5,很不错，不过好像不用预约就能进😬
2018-01-30,未知,5,云集柳州的历史变迁，还是值得一看的
2023-08-27,广西,5,还不错，如果再多点看点就更加好！
2020-11-20,未知,3,进柳州博物馆免费，不收取任何费用
2019-11-14,未知,5,不错，不错，很不错，景色非常优美
2016-07-23,未知,3,值得去的好地方。风景很好。很干净
2024-01-29,上海,5,非常不错，值得推荐，又涨知识了
2023-11-23,江苏,5,每到一座城市，博物馆是必打卡的
2019-10-14,未知,5,柳州工业城市，历史悠久，加油！
2023-08-05,广西,4,带小孩，算是比较合适的活动地点，夏天来可以躲开高温，也能学到点东西
2024-07-15,湖南,5,很好看，里面很多非遗展览
2024-02-19,江苏,5,不错。有价值。值得一看。
2024-02-27,广西,5,很棒的一次博物馆之旅。
2024-01-13,江苏,5,很有民族特色和地域特色
2023-08-01,广西,5,很好，小孩子玩的很开心
2023-07-12,广西,5,带孩子了解柳州，不错。
2023-07-03,广西,5,带娃去的收获满满很开心
2024-08-02,广西,5,出行必备App很方便
2023-07-21,广西,5,非常好，柳州必到之地
2016-03-14,未知,3,还可以。 就是小了一点
2023-09-10,四川,5,很不错，值得去一次
2023-05-30,重庆,5,很好，下次还来这家
2023-01-26,广西,5,佛教的起源讲得不错
2024-05-25,河南,5,好…………………
2024-02-01,广西,5,非常哈哈哈哈哈哈
2023-08-04,广西,5,柳州博物馆挺好的
2023-07-30,广东,5,还不错，值得一看
2023-07-22,贵州,5,👍👍👍👍
2023-07-03,广西,5,不用门票非常好。
2023-04-06,广西,5,非常不戳，非常好
2024-09-28,广西,5,博物馆内容丰富
2024-09-07,广西,5,非常好玩的地方
2024-03-01,广东,5,非常好的体验。
2023-10-03,广东,5,孩子玩得开心。
2023-09-05,广西,5,身临其境的感觉
2023-07-03,广西,5,带娃去的很开心
2023-06-25,广西,5,下雨天来逛一逛
2023-06-17,广西,5,还行，哈哈哈哈
2023-06-04,广西,5,非常好，很喜欢
2023-05-17,广西,5,好，停车场大。
2023-05-15,上海,5,非常好，很满意
2024-08-03,湖南,5,很有意思！…
2024-03-17,广西,5,博物馆挺好的
2024-02-08,四川,5,➍➌➏➍➋➏
2023-10-14,广东,5,很有历史价值
2023-10-11,广东,4,面积不大，假期高峰人比较多，建议非高峰期去看看即可。
2023-10-01,广西,5,化石品种丰富
2023-08-16,湖南,5,哈哈哈哈哈好
2023-08-15,广西,5,博物馆超棒！
2023-08-11,广东,5,各方面都很棒
2023-05-02,广东,5,可以看半天！
2024-05-26,广东,5,不错的很好
2024-02-21,天津,5,感觉挺好的
2024-01-06,上海,5,挺方便的呢
2023-08-03,广西,5,非常非常好
2023-05-09,中国澳门,5,開心的出行
2023-03-29,广西,5,值得转一转
2023-08-12,广西,4,主要是人太多了，内容还是挺丰富，小朋友喜欢
2023-02-16,广东,4,可以去看看的，毕竟博物馆里的都是珍贵文物
2023-08-20,广西,4,不错的博物馆，内容丰富，小朋友很喜欢
2023-10-05,广西,3,除了不要钱以外，真的好像没什么优点，馆也不大，人超级多！到此一游吧
2023-08-11,广西,3,周一闭馆，停车位比较少。
2023-02-01,广东,4,还不错，可以花点时间看看
2023-01-16,云南,4,没太多的特色，不建议参观
2023-07-15,广西,4,不错，有观赏意义
2023-07-15,广西,4,不错，有观赏价值
2023-08-16,湖南,4,很方便还不错
2023-08-10,广西,4,好像也就那样
2023-03-18,广东,4,不需要了。
2023-02-16,广东,4,值得一看的
2023-01-27,湖南,3,软件设施很一般 ，在内容介绍上很差
2023-07-30,广东,1,非常差的体验感。7月29日中午博物馆门口安检那位戴眼镜的男工作人员，态度非常非常差，对外来游客都是嫌弃，满脸怨气，对于不熟悉的游客辱骂驱赶，没有任何礼貌，也没有任何指导性的指引，就是吼和骂，把小孩都骂哭。这就是柳州市给游客应有的服务？
2023-07-06,广西,1,订单上写着入馆时间是9：00-17:00，结果到了工作人员说是16:00入园，四点半到然后根本进不了，简直就是骗人
2023-07-25,广西,1,东门西门南门，只有东门开放，预定时也没有任何说明，现场也没有醒目标志，非要人家到了其它门的门口才知道要绕一大圈到东门
2023-08-05,广西,2,很一般，门票免费。时间富裕可以去看看！
2023-08-16,广西,2,不能停车，没有参观
2023-03-10,山东,1,头一天预约的，第二天停电闭馆，从南宁白跑一趟，管理太差！
